{
  "$schema": "https://json-schema.org/draft/2020-12/schema",
  "$id": "https://robotindex.io/schema/product.schema.json",
  "title": "robotindex Product Record",
  "description": "Canonical record for one product in the robotindex directory. One file per product under data/products/<id>.json. The live HTML page for a product is rendered from this record, not hand-authored separately.",
  "type": "object",
  "required": ["id", "slug", "name", "manufacturer", "category", "subcategory", "tier", "flags", "description", "specs", "sourcing"],
  "additionalProperties": false,
  "properties": {
    "$schema": { "type": "string", "description": "Editor/tooling hint pointing back at this schema file. Not semantically meaningful." },
    "id": {
      "type": "string",
      "pattern": "^[a-z0-9]+(-[a-z0-9]+)*$",
      "description": "Stable unique id, kebab-case. Never reused, never renamed once published — other records and tooling reference a product by this id, not by its slug or name."
    },
    "slug": {
      "type": "string",
      "pattern": "^[a-z0-9]+(-[a-z0-9]+)*\\.html$",
      "description": "Generated page filename, e.g. 'product-unitree-go2.html'. Kept separate from id so the URL can change (renames, restructuring) without breaking references that use id."
    },
    "name": { "type": "string", "description": "Display name, e.g. 'Unitree Go2'." },
    "manufacturer": { "type": "string", "description": "Company or project name, e.g. 'Unitree Robotics'." },
    "manufacturerUrl": { "type": "string", "format": "uri", "description": "Official product or manufacturer page." },
    "category": { "type": "string", "description": "Top-level directory category, e.g. 'Humanoid & General Purpose'." },
    "subcategory": { "type": "string", "description": "Directory subcategory, e.g. 'Four Legs'." },
    "tier": {
      "type": "string",
      "enum": ["featured", "pending"],
      "description": "Editorial confidence/completeness tier shown as the product-meta badge. 'pending' = newly added or thinner sourcing; matches today's directory.js tier field."
    },
    "flags": {
      "type": "object",
      "additionalProperties": false,
      "properties": {
        "pending": { "type": "boolean", "description": "Not yet released, or availability unconfirmed. Distinct from tier: a shipped product can still be tier=pending due to thin sourcing." },
        "openSource": { "type": "boolean", "description": "True only if this product itself (hardware and/or software) qualifies under robotindex's Strict Open Source policy. Must agree with whether firmwareCommunity references an 'opensource' entry in builds-mods.json — these two must not be set independently by hand, or they drift the way the site's data did before this schema existed." },
        "closedPlatform": { "type": "boolean", "description": "True if the manufacturer has released no public SDK, firmware repo, or developer API. Drives the 'Closed platform' Firmware & Community message." }
      }
    },
    "description": {
      "type": "string",
      "description": "Short 1-3 sentence summary shown under the product name (today's .product-desc)."
    },
    "image": {
      "type": "object",
      "additionalProperties": false,
      "required": ["src", "credit"],
      "properties": {
        "src": { "type": "string", "description": "Path under /images/." },
        "alt": { "type": "string" },
        "credit": { "type": "string", "description": "e.g. 'Unitree Robotics (official)'." }
      }
    },
    "specs": {
      "type": "array",
      "description": "Ordered list of spec cards. Deliberately NOT a fixed field set — a drone, a vacuum, and a robot arm share almost no spec names in practice (checked across the live pages: 'Suction'/'Mopping' for vacuums, 'Cutting Width'/'Max Slope' for mowers, 'Degrees of Freedom'/'Repeatability' for arms, 'Height'/'Hand DOF' for humanoids). Forcing one schema of named fields across categories would either lose real data or invent empty fields. Label/value/note as free text, ordered for display, is the closest structured form that doesn't lose information.",
      "items": {
        "type": "object",
        "required": ["label", "value"],
        "additionalProperties": false,
        "properties": {
          "label": { "type": "string", "description": "e.g. 'Battery', 'Suction', 'Degrees of Freedom'." },
          "value": { "type": "string", "description": "Primary display value, e.g. '36,000 Pa'." },
          "note": { "type": "string", "description": "Secondary clarifying text shown smaller underneath (today's <small> tag), e.g. 'HyperForce digital motor'." }
        }
      }
    },
    "pricing": {
      "type": "object",
      "additionalProperties": false,
      "properties": {
        "summary": { "type": "string", "description": "Prose price statement shown under the 'Reference Price' heading." },
        "tiers": {
          "type": "array",
          "description": "Present only for products sold in multiple tiers (e.g. Go2 Air/Pro/X/EDU). Omit entirely for single-price or no-price products.",
          "items": {
            "type": "object",
            "required": ["tier", "price"],
            "additionalProperties": false,
            "properties": {
              "tier": { "type": "string" },
              "price": { "type": "string" },
              "notes": { "type": "string" }
            }
          }
        }
      }
    },
    "editorial": {
      "type": "array",
      "description": "Long-form narrative sections beyond specs/pricing (today's freeform 'Sensors & Hardware', 'X — Worth Knowing', 'Generation Comparison', etc. headings, which vary per product and shouldn't be forced into one taxonomy). Body is markdown. This is intentionally the one place the schema stays loose — it's editorial voice, not data, and structuring it further would just be re-inventing prose as fields.",
      "items": {
        "type": "object",
        "required": ["heading", "body"],
        "additionalProperties": false,
        "properties": {
          "heading": { "type": "string" },
          "body": { "type": "string", "description": "Markdown." }
        }
      }
    },
    "firmwareCommunity": {
      "type": "array",
      "description": "Links into builds-mods.json by id, OR an explanation for why there isn't one. This is the field that was hand-duplicated (name + desc copy-pasted onto the product page AND into builds-mods.html's arrays) and drifted out of sync twice in one audit. Referencing by id instead of copying text makes that class of bug structurally impossible: there is exactly one place a repo's name/desc live.",
      "items": {
        "oneOf": [
          {
            "type": "object",
            "required": ["buildsModsId"],
            "additionalProperties": false,
            "properties": {
              "buildsModsId": { "type": "string", "description": "id of an entry in data/builds-mods.json." }
            }
          },
          {
            "type": "object",
            "required": ["status", "note"],
            "additionalProperties": false,
            "properties": {
              "status": {
                "type": "string",
                "enum": ["closed-platform", "unlicensed", "not-listed"],
                "description": "closed-platform: no public SDK/firmware/API at all. unlicensed: a real repo exists but has no stated open license, so it doesn't qualify for builds-mods.json. not-listed: repo qualifies but hasn't been added yet."
              },
              "note": { "type": "string", "description": "The explanatory sentence shown in place of a link, e.g. 'Tesla has not released a public SDK...'." }
            }
          }
        ]
      }
    },
    "sourcing": {
      "type": "string",
      "description": "The citation/caveat text shown at the bottom of the page (today's .verify-note) — where the specs above came from and what couldn't be confirmed. Required on every record: this is what lets a developer building on this data trust it, or know exactly how much to trust it."
    }
  }
}
