{
  "$schema": "../../schema/product.schema.json",
  "id": "smp-robotics-s5-series",
  "slug": "product-smp-robotics-s5-series",
  "name": "SMP Robotics Argus S5.3",
  "manufacturer": "SMP Robotics",
  "category": "Security",
  "subcategory": "Outdoor Security",
  "tier": "featured",
  "flags": {
    "pending": false,
    "openSource": false,
    "closedPlatform": true
  },
  "description": "SMP Robotics' flagship four-wheeled, weatherproof autonomous patrol robot, built around a raised camera mast with six 720p panoramic cameras plus a PTZ thermal/visual zoom camera, marketed for 24/7 autonomous patrol of industrial sites, energy plants, logistics hubs, and airports. Route-based autonomy with central-station monitoring and multi-robot fleet compatibility; sold, leased, or subscribed to on a B2B basis.",
  "specs": [
    {
      "label": "Weight",
      "value": "69 kg no batteries",
      "note": "133 kg with batteries — per usai-robotics.com's Argus S5.3 spec sheet"
    },
    {
      "label": "Battery",
      "value": "2× 12.6V 100Ah",
      "note": "lead-acid; 10–12 hr operating time, 2–3 hr charge"
    },
    {
      "label": "Connectivity",
      "value": "4G LTE, WiFi, Bluetooth",
      "note": "plus WiFi Ad Hoc mesh between units"
    },
    {
      "label": "Navigation",
      "value": "Route-based autonomy",
      "note": "vision/landmark + GPS, not free-roam SLAM"
    },
    {
      "label": "Mobility",
      "value": "4-wheeled ground robot",
      "note": "raised rotating camera mast/periscope"
    },
    {
      "label": "Cameras",
      "value": "6× 720p panoramic",
      "note": "+ PTZ thermal/visual zoom (optical ×30, digital ×12)"
    },
    {
      "label": "Detection Range",
      "value": "Thermal 150m",
      "note": "visual PTZ 100m; panoramic 25m; face recognition 50m (day)"
    },
    {
      "label": "Range / Runtime",
      "value": "24 km",
      "note": "10–12 hrs patrol per charge (mfr. figure)"
    },
    {
      "label": "Speed",
      "value": "4–6 km/h",
      "note": "~2.5–3.7 mph, autonomous cruising"
    },
    {
      "label": "Sensing Extras",
      "value": "Two-way audio",
      "note": "siren, horn loudspeaker, overhead + rear obstacle detection"
    },
    {
      "label": "Business Model",
      "value": "Purchase, lease, or subscription",
      "note": "B2B / enterprise only"
    },
    {
      "label": "Subscription",
      "value": "Optional quarterly SaaS tier",
      "note": "\"split\" OPEX path: buy hardware/basic software, then pay quarterly for autopilot/analytics/24-7 support — smprobotics.com; price quoted per deployment"
    }
  ],
  "sourcing": "Verified against SMP Robotics' own site (smprobotics.com, smpsecurityrobot.com — including its Argus S5.3 promotional and product pages), the Argus S5.3 spec sheet hosted by usai-robotics.com, and market-listing coverage from Mordor Intelligence and SecurityInfoWatch; a 2016 IPVM trade report was only accessible in summary/paywalled form. This entry was renamed from a generic \"S5 Series\" listing to the specific Argus S5.3 model — SMP's own current site calls it their flagship — and specs were updated accordingly (weight, battery, connectivity, camera and detection-range figures now reflect the S5.3 sheet rather than the older, less specific S5.2-derived numbers this page previously carried). PTZ zoom and thermal detection-range figures vary across the manufacturer's own pages by product generation. A formal IP rating was not found in any accessible source. Named enterprise customers and \"leading manufacturer\" positioning are self-reported marketing claims, not independently confirmed. No connection to Knightscope or its unrelated fountain incident.",
  "manufacturerUrl": "https://smprobotics.com/security_robot/",
  "pricing": {
    "summary": "No public pricing is listed anywhere — every SMP Robotics product page (including the current Argus S5.3 listing) routes to a sales quote request. The manufacturer offers outright purchase, leasing, and a hardware-plus-subscription model, with terms arranged per deployment rather than published. A 10% hardware-only discount promotion for Argus S5.3 units was running as of late 2025."
  },
  "editorial": [
    {
      "heading": "Naming Caveat",
      "body": "This entry now tracks the Argus S5.3 specifically — SMP Robotics' own current site describes it as their \"flagship\" model, distinct from the more affordable Argus S5.2 (which shares the same general platform at a lower weight/spec tier) and the newer S5.4 (built around an NVIDIA Jetson Orin NX for third-party AI software). Earlier \"HD\" and \"Perimeter\" naming seen on some listings appears to describe configurations rather than separate SMP-branded model names; this page no longer uses that framing now that Argus S5.3 is confirmed as the specific model. Navigation is route-based (visual landmarks, GPS, night markers), not SLAM mapping. No LiDAR or formal IP rating was found for this model."
    },
    {
      "heading": "Insights",
      "body": "SMP Robotics is sometimes confused with an unrelated incident: the well-known video of a security robot falling into a fountain involves Knightscope's K5, a different company entirely, not SMP Robotics. Argus S5.3 is positioned above the Argus S5.2 largely on detection range and camera hardware (PTZ thermal/visual zoom vs. panoramic-only), while both share the same route-based autonomy and general chassis."
    }
  ],
  "firmwareCommunity": [
    {
      "status": "closed-platform",
      "note": "SMP Robotics has not released a public SDK, firmware repo, or developer API for the Argus S5.3. Not currently listed in Builds & Mods."
    }
  ]
}